{
  "profileId": "SMProfile-ProductionPart",
  "version": "2.0.0",
  "standard": "OSF",
  "displayName": "Production Part Event (Abstract Parent)",
  "category": "intelligence",
  "description": "Abstract parent for the part-lineage entities. Each is its OWN entity with own provenance, timestamp, source and confidence — NOT a property on an Order. Models the Multi-Truth part counts of an order (produced/scrap/loss/ghost + booking claims) so divergence is first-class instead of being collapsed into one order field. Minted by the discrepancy-engine reconcile path and emitted onto the KG snapshot (services/discrepancy-engine/src/snapshot.ts partObject:68-92); the concrete label rides in as entity_type (types.ts ProductionPart:325-355). Never edge-sourced — therefore no delivery/scope/promotion wire-contract.",
  "parentType": null,
  "abstract": true,
  "attributes": [
    {
      "name": "part_event_id",
      "dataType": "String",
      "category": "Core",
      "isKey": true,
      "description": "Unique part-event id (deterministic hash of order|label|source — ids.ts partEventId)"
    },
    {
      "name": "quantity",
      "dataType": "Int32",
      "category": "Core",
      "description": "Number of parts in this event"
    },
    {
      "name": "source",
      "dataType": "String",
      "category": "Provenance",
      "description": "Originating source (sap | plc_counter | bde | worker_note | inferred)"
    },
    {
      "name": "confidence",
      "dataType": "Float",
      "category": "Provenance",
      "description": "0..1 confidence in this count"
    },
    {
      "name": "provenance",
      "dataType": "Json",
      "category": "Provenance",
      "description": "Structured provenance (raw refs, extractor, evidence) — JSON-serialised by the snapshot builder"
    },
    {
      "name": "recorded_at",
      "dataType": "DateTime",
      "category": "Core",
      "description": "When the event was recorded"
    },
    {
      "name": "recorded_by",
      "dataType": "String",
      "category": "Provenance",
      "description": "Actor/system that recorded it"
    }
  ],
  "relationships": [
    {
      "type": "FOR_ORDER",
      "target": "ProductionOrder",
      "targetIdProp": "production_order_no",
      "description": "Order this part-event belongs to (snapshot.ts partObject:69; to_element_id = part.for_order_no)"
    },
    {
      "type": "ON_MACHINE",
      "target": "Machine",
      "targetIdProp": "machine_id",
      "description": "Machine that produced it (snapshot.ts partObject:70; optional)"
    },
    {
      "type": "OF_ARTICLE",
      "target": "Article",
      "targetIdProp": "article_no",
      "description": "Article produced (snapshot.ts partObject:71; optional)"
    }
  ],
  "kgNodeLabel": "ProductionPart",
  "kgIdProperty": "part_event_id",
  "isa95": {
    "objectModel": "Extension",
    "extension": true,
    "momDomain": "production",
    "note": "Intelligence entity (Multi-Truth/SDC) — ISA-95 extension"
  }
}
